{
  "$schema": "https://json-schema.org/draft/2020-12/schema",
  "title": "audio-to-post output v1",
  "type": "object",
  "additionalProperties": false,
  "required": [
    "contract_version",
    "run_id",
    "status",
    "quality_flags",
    "processing_timestamps",
    "debug_reference_id"
  ],
  "properties": {
    "contract_version": {
      "type": "string",
      "pattern": "^1\\.[0-9]+\\.[0-9]+$"
    },
    "run_id": {
      "type": "string",
      "minLength": 8
    },
    "post_id": {
      "type": "integer",
      "minimum": 1
    },
    "post_url": {
      "type": "string",
      "format": "uri"
    },
    "status": {
      "type": "string",
      "enum": ["pending", "processing", "completed", "failed"]
    },
    "quality_flags": {
      "type": "array",
      "items": { "type": "string" }
    },
    "processing_timestamps": {
      "type": "object",
      "additionalProperties": false,
      "properties": {
        "started_at": { "type": "string", "format": "date-time" },
        "completed_at": { "type": "string", "format": "date-time" }
      }
    },
    "debug_reference_id": {
      "type": "string",
      "minLength": 8
    },
    "error": {
      "type": "object",
      "additionalProperties": false,
      "required": ["code", "message", "retryable"],
      "properties": {
        "code": {
          "type": "string",
          "enum": [
            "invalid_input",
            "unauthorized",
            "duplicate_run",
            "ai_provider_unavailable",
            "publish_failed",
            "internal_error"
          ]
        },
        "message": { "type": "string" },
        "retryable": { "type": "boolean" },
        "details": { "type": "object", "additionalProperties": true }
      }
    }
  },
  "allOf": [
    {
      "if": {
        "properties": { "status": { "const": "completed" } },
        "required": ["status"]
      },
      "then": { "required": ["post_id", "post_url"] }
    },
    {
      "if": {
        "properties": { "status": { "const": "failed" } },
        "required": ["status"]
      },
      "then": { "required": ["error"] }
    }
  ]
}
